{
  "id": "jcode-benchmark-pilot",
  "name": "JCode benchmark pilot",
  "summary": "Benchmark one isolated repository task on success rate, review defects, latency, and total model cost.",
  "category": "coding-agent-harness",
  "status": "pilot",
  "source": {
    "canonical_repo_or_product": "1jehuang/jcode",
    "url": "https://github.com/1jehuang/jcode",
    "license_or_terms": "MIT"
  },
  "local_modifications": "",
  "compatible_profiles": ["experimental"],
  "added_date": "2026-07-17",
  "notes": "See catalog/repositories.csv row for full rationale."
}
