{
  "id": "repomix-context-export",
  "name": "Repomix context packaging",
  "summary": "Local allowlisted repository context export with built-in checks plus Gitleaks on the final bundle; online upload prohibited for sensitive repos.",
  "category": "repository-context-packaging",
  "status": "adopt_now",
  "source": {
    "canonical_repo_or_product": "yamadashy/repomix",
    "url": "https://github.com/yamadashy/repomix",
    "version_or_commit": "v1.16.1",
    "license_or_terms": "MIT"
  },
  "local_modifications": "Run locally only; no online upload for sensitive repos.",
  "compatible_profiles": ["core", "product-build"],
  "added_date": "2026-07-17",
  "notes": "See catalog/repositories.csv row for full rationale."
}
