{
  "id": "promptfoo-eval-gate",
  "name": "Promptfoo evaluation gate",
  "summary": "Pinned repo-native activation, regression, negative, injection, and budgeted-provider tests used as the promotion gate for any curated capability.",
  "category": "evaluation",
  "status": "adopt_now",
  "source": {
    "canonical_repo_or_product": "promptfoo/promptfoo",
    "url": "https://github.com/promptfoo/promptfoo",
    "version_or_commit": "v0.121.19",
    "license_or_terms": "MIT"
  },
  "local_modifications": "",
  "compatible_profiles": ["core", "product-build"],
  "added_date": "2026-07-17",
  "notes": "See catalog/repositories.csv row for full rationale."
}
