{
  "id": "obsidian-skills-vault",
  "name": "Obsidian vault skills (Markdown, Bases, Canvas)",
  "summary": "Pinned, selectively enabled Markdown/Bases/Canvas skills for personal knowledge-vault work; CLI/Defuddle stay optional.",
  "category": "knowledge-vault",
  "status": "adopt_now",
  "source": {
    "canonical_repo_or_product": "kepano/obsidian-skills",
    "url": "https://github.com/kepano/obsidian-skills",
    "license_or_terms": "MIT"
  },
  "local_modifications": "Only Markdown, Bases, and Canvas skills enabled by default.",
  "compatible_profiles": ["michaelos"],
  "added_date": "2026-07-17",
  "notes": "See catalog/repositories.csv row for full rationale."
}
