{
  "id": "playwright-regression",
  "name": "Playwright browser regression evidence",
  "summary": "Canonical checked-in browser regression and evidence framework; credentials must never appear in traces.",
  "category": "browser-testing",
  "status": "adopt_now",
  "source": {
    "canonical_repo_or_product": "microsoft/playwright",
    "url": "https://github.com/microsoft/playwright",
    "version_or_commit": "v1.61.1",
    "license_or_terms": "Apache-2.0"
  },
  "local_modifications": "",
  "compatible_profiles": ["product-build", "accentos"],
  "added_date": "2026-07-17",
  "notes": "See catalog/repositories.csv row for full rationale."
}
