{
  "id": "gitleaks-secret-scan",
  "name": "Gitleaks secret scanning",
  "summary": "Checksum-verified pinned version used as the baseline local artifact/repo secret scanner, ahead of a measured Betterleaks comparison.",
  "category": "secret-scanning",
  "status": "adopt_now",
  "source": {
    "canonical_repo_or_product": "gitleaks/gitleaks",
    "url": "https://github.com/gitleaks/gitleaks",
    "version_or_commit": "v8.30.1",
    "license_or_terms": "MIT"
  },
  "local_modifications": "",
  "compatible_profiles": ["core", "product-build", "accentos", "michaelos"],
  "added_date": "2026-07-17",
  "notes": "See catalog/repositories.csv row for full rationale."
}
