{
  "id": "gstack-review-workflow",
  "name": "gstack review and build workflow",
  "summary": "Profiled subset of gstack used as the primary product-build and code-review workflow; deploy and team auto-update features stay opt-in.",
  "category": "coding-workflow",
  "status": "adopt_now",
  "source": {
    "canonical_repo_or_product": "garrytan/gstack",
    "url": "https://github.com/garrytan/gstack",
    "license_or_terms": "MIT"
  },
  "local_modifications": "Deploy and auto-update features disabled by default; only the review/build workflow subset is enabled.",
  "compatible_profiles": ["core", "product-build", "accentos", "michaelos"],
  "added_date": "2026-07-17",
  "notes": "See catalog/repositories.csv row for full rationale."
}
