{
  "id": "docling-ingestion",
  "name": "Docling local document ingestion",
  "summary": "Version-pinned sandboxed canonical local document parser; only reviewed derived knowledge is stored in shared repos, never raw sensitive corpora.",
  "category": "document-ingestion",
  "status": "adopt_now",
  "source": {
    "canonical_repo_or_product": "docling-project/docling",
    "url": "https://github.com/docling-project/docling",
    "version_or_commit": "v2.113.0",
    "license_or_terms": "MIT code; downloaded models/assets may have separate terms"
  },
  "local_modifications": "",
  "compatible_profiles": ["michaelos"],
  "added_date": "2026-07-17",
  "notes": "See catalog/repositories.csv row for full rationale."
}
